Name	Protein identifier	Gene symbol	Sequence name	Scope	Element type	Element subtype	Class	Subclass	Method	Target length	Reference sequence length	% Coverage of reference sequence	% Identity to reference sequence	Alignment length	Accession of closest sequence	Name of closest sequence	HMM id	HMM description
GCF_000165525.1	EJFNJEFF_00042	mtrF	AbgT family antimetabolite efflux transporter MtrF	plus	STRESS	BIOCIDE	EFFLUX	EFFLUX	BLASTP	523	533	97.56	80.81	521	ACF30256.1	AbgT family antimetabolite efflux transporter MtrF	NA	NA
GCF_000165525.1	EJFNJEFF_00212	yfeA	iron/manganese ABC transporter substrate-binding protein YfeA	plus	VIRULENCE	VIRULENCE	NA	NA	PARTIALP	293	322	84.16	74.91	271	AAC46147.1	iron/manganese ABC transporter substrate-binding protein YfeA	NA	NA
GCF_000165525.1	EJFNJEFF_00213	yfeB	iron/manganese ABC transporter ATP-binding protein YfeB	plus	VIRULENCE	VIRULENCE	NA	NA	BLASTP	306	296	92.91	71.64	275	AAC46148.1	iron/manganese ABC transporter ATP-binding protein YfeB	NA	NA
GCF_000165525.1	EJFNJEFF_00575	blaTEM-1	class A broad-spectrum beta-lactamase TEM-1	core	AMR	AMR	BETA-LACTAM	BETA-LACTAM	ALLELEP	286	286	100.00	100.00	286	WP_000027057.1	class A broad-spectrum beta-lactamase TEM-1	NF000531.2	TEM family class A beta-lactamase
GCF_000165525.1	EJFNJEFF_01148	hmrM	sodium-coupled multidrug efflux MATE transporter HmrM	plus	AMR	AMR	EFFLUX	EFFLUX	BLASTP	464	464	100.00	97.20	464	AAC23256.1	sodium-coupled multidrug efflux MATE transporter HmrM	NA	NA
